{
  "schemaVersion": "1.0",
  "status": "partial",
  "reasonCodes": ["legacy_inventory_partial"],
  "source": {
    "product": "codex_quota_viewer",
    "format": "quotaviewer-1.2.0-120",
    "baselineCommit": "261fe1c",
    "readOnly": true
  },
  "inventory": [
    {"kind":"settings","state":"invalid","fileCount":1,"recordCount":0,"sourceBytes":78,"reasonCodes":["legacy_json_shape_invalid"]},
    {"kind":"account_index","state":"present","fileCount":1,"recordCount":2,"sourceBytes":371,"reasonCodes":["legacy_account_index_valid"]},
    {"kind":"account_records","state":"present","fileCount":2,"recordCount":1,"sourceBytes":212,"reasonCodes":["legacy_account_records_valid"]},
    {"kind":"quota_cache","state":"invalid","fileCount":1,"recordCount":0,"sourceBytes":22,"reasonCodes":["legacy_json_shape_invalid"]},
    {"kind":"session_manager_settings","state":"missing","fileCount":0,"recordCount":0,"sourceBytes":0,"reasonCodes":["legacy_artifact_not_present"]},
    {"kind":"provider_mode","state":"present","fileCount":1,"recordCount":1,"sourceBytes":173,"reasonCodes":["legacy_provider_mode_valid"]},
    {"kind":"restore_points","state":"missing","fileCount":0,"recordCount":0,"sourceBytes":0,"reasonCodes":["legacy_artifact_not_present"]}
  ],
  "plan": [
    {"target":"monitor_settings","disposition":"blocked","sourceItemCount":0,"expectedTargetCount":0,"reasonCode":"legacy_source_blocked"},
    {"target":"shell_preferences","disposition":"blocked","sourceItemCount":0,"expectedTargetCount":0,"reasonCode":"legacy_source_blocked"},
    {"target":"work_plan","disposition":"blocked","sourceItemCount":0,"expectedTargetCount":0,"reasonCode":"legacy_source_blocked"},
    {"target":"account_vault","disposition":"review","sourceItemCount":1,"expectedTargetCount":1,"reasonCode":"legacy_account_identity_resolution_required"},
    {"target":"quota_cache","disposition":"blocked","sourceItemCount":0,"expectedTargetCount":0,"reasonCode":"legacy_source_blocked"},
    {"target":"session_preferences","disposition":"skip","sourceItemCount":0,"expectedTargetCount":0,"reasonCode":"legacy_source_not_present"},
    {"target":"provider_mode_state","disposition":"review","sourceItemCount":1,"expectedTargetCount":1,"reasonCode":"legacy_provider_state_review_required"},
    {"target":"restore_point_ledger","disposition":"skip","sourceItemCount":0,"expectedTargetCount":0,"reasonCode":"legacy_source_not_present"}
  ],
  "conflicts": [
    {"kind":"duplicate_account_id","count":1,"reasonCode":"legacy_duplicate_account_id"},
    {"kind":"missing_account_record","count":1,"reasonCode":"legacy_account_record_missing"},
    {"kind":"orphan_account_record","count":1,"reasonCode":"legacy_account_record_orphaned"},
    {"kind":"provider_restore_point_missing","count":1,"reasonCode":"legacy_provider_restore_point_missing"}
  ],
  "spaceEstimate": {
    "sourceBytes": 856,
    "minimumFreeBytes": 1050288,
    "status": "target_preflight_required"
  }
}
